### ISSUE TITLE
About ignoreStreamIds for connecting to Open5GS

### ISSUE THREAD

**Issue by s5uishida** [aligungr/UERANSIM#137]
In the latest version of Open5GS and UERANSIM, when I run `NG-Setup / Registration / PDU session establishment` when `ignoreStreamIds=false/true` and checked pcap files, these packets look like the same SID's sequences as below.
- `ignoreStreamIds=false` [ignoreStreamIdsFalse.pcap.gz](https://github.com/aligungr/UERANSIM/files/5222381/ignoreStreamIdsFalse.pcap.gz)
```
root@open5gs01:~# tcpdump -r ignoreStreamIdsFalse.pcap |grep sctp |grep SID
reading from file ignoreStreamIdsFalse.pcap, link-type LINUX_SLL (Linux cooked)
01:18:47.792590 IP localhost.47493 > localhost.38412: sctp (1) [DATA] (B)(E) [TSN: 2277067741] [SID: 0] [SSEQ 0] [PPID 0x3c] 
01:18:47.793196 IP localhost.38412 > localhost.47493: sctp (1) [DATA] (B)(E) [TSN: 2767267129] [SID: 0] [SSEQ 0] [PPID 0x3c] 
01:18:50.627578 IP localhost.47493 > localhost.38412: sctp (1) [DATA] (B)(E) [TSN: 2277067742] [SID: 1] [SSEQ 0] [PPID 0x3c] 
01:18:50.630447 IP localhost.38412 > localhost.47493: sctp (1) [SACK] [cum ack 2277067742] [a_rwnd 106496] [#gap acks 0] [#dup tsns 0] , (2) [DATA] (B)(E) [TSN: 2767267130] [SID: 1] [SSEQ 0] [PPID 0x3c] 
01:18:50.776327 IP localhost.47493 > localhost.38412: sctp (1) [SACK] [cum ack 2767267130] [a_rwnd 106496] [#gap acks 0] [#dup tsns 0] , (2) [DATA] (B)(E) [TSN: 2277067743] [SID: 1] [SSEQ 1] [PPID 0x3c] 
01:18:50.778036 IP localhost.38412 > localhost.47493: sctp (1) [SACK] [cum ack 2277067743] [a_rwnd 106496] [#gap acks 0] [#dup tsns 0] , (2) [DATA] (B)(E) [TSN: 2767267131] [SID: 1] [SSEQ 1] [PPID 0x3c] 
01:18:51.171621 IP localhost.47493 > localhost.38412: sctp (1) [DATA] (B)(E) [TSN: 2277067744] [SID: 1] [SSEQ 2] [PPID 0x3c] 
01:18:51.176046 IP localhost.38412 > localhost.47493: sctp (1) [SACK] [cum ack 2277067744] [a_rwnd 106496] [#gap acks 0] [#dup tsns 0] , (2) [DATA] (B)(E) [TSN: 2767267132] [SID: 1] [SSEQ 2] [PPID 0x3c] 
01:18:51.227277 IP localhost.47493 > localhost.38412: sctp (1) [SACK] [cum ack 2767267132] [a_rwnd 106496] [#gap acks 0] [#dup tsns 0] , (2) [DATA] (B)(E) [TSN: 2277067745] [SID: 1] [SSEQ 3] [PPID 0x3c] 
01:18:51.425847 IP localhost.47493 > localhost.38412: sctp (1) [DATA] (B)(E) [TSN: 2277067746] [SID: 1] [SSEQ 4] [PPID 0x3c] 
01:18:51.426174 IP localhost.38412 > localhost.47493: sctp (1) [SACK] [cum ack 2277067746] [a_rwnd 106496] [#gap acks 0] [#dup tsns 0] , (2) [DATA] (B)(E) [TSN: 2767267133] [SID: 1] [SSEQ 3] [PPID 0x3c] 
01:18:55.568444 IP localhost.47493 > localhost.38412: sctp (1) [DATA] (B)(E) [TSN: 2277067747] [SID: 1] [SSEQ 5] [PPID 0x3c] 
01:18:55.573410 IP localhost.38412 > localhost.47493: sctp (1) [SACK] [cum ack 2277067747] [a_rwnd 106496] [#gap acks 0] [#dup tsns 0] , (2) [DATA] (B)(E) [TSN: 2767267134] [SID: 1] [SSEQ 4] [PPID 0x3c] 
01:18:55.628891 IP localhost.47493 > localhost.38412: sctp (1) [SACK] [cum ack 2767267134] [a_rwnd 106496] [#gap acks 0] [#dup tsns 0] , (2) [DATA] (B)(E) [TSN: 2277067748] [SID: 1] [SSEQ 6] [PPID 0x3c] 
```
- `ignoreStreamIds=true` [ignoreStreamIdsTrue.pcap.gz](https://github.com/aligungr/UERANSIM/files/5222385/ignoreStreamIdsTrue.pcap.gz)
```
root@open5gs01:~# tcpdump -r ignoreStreamIdsTrue.pcap |grep sctp |grep SID
reading from file ignoreStreamIdsTrue.pcap, link-type LINUX_SLL (Linux cooked)
01:16:23.003234 IP localhost.47509 > localhost.38412: sctp (1) [DATA] (B)(E) [TSN: 969171229] [SID: 0] [SSEQ 0] [PPID 0x3c] 
01:16:23.003399 IP localhost.38412 > localhost.47509: sctp (1) [DATA] (B)(E) [TSN: 2583310719] [SID: 0] [SSEQ 0] [PPID 0x3c] 
01:16:27.774161 IP localhost.47509 > localhost.38412: sctp (1) [DATA] (B)(E) [TSN: 969171230] [SID: 1] [SSEQ 0] [PPID 0x3c] 
01:16:27.777326 IP localhost.38412 > localhost.47509: sctp (1) [SACK] [cum ack 969171230] [a_rwnd 106496] [#gap acks 0] [#dup tsns 0] , (2) [DATA] (B)(E) [TSN: 2583310720] [SID: 1] [SSEQ 0] [PPID 0x3c] 
01:16:27.916062 IP localhost.47509 > localhost.38412: sctp (1) [SACK] [cum ack 2583310720] [a_rwnd 106496] [#gap acks 0] [#dup tsns 0] , (2) [DATA] (B)(E) [TSN: 969171231] [SID: 1] [SSEQ 1] [PPID 0x3c] 
01:16:27.917604 IP localhost.38412 > localhost.47509: sctp (1) [SACK] [cum ack 969171231] [a_rwnd 106496] [#gap acks 0] [#dup tsns 0] , (2) [DATA] (B)(E) [TSN: 2583310721] [SID: 1] [SSEQ 1] [PPID 0x3c] 
01:16:28.280503 IP localhost.47509 > localhost.38412: sctp (1) [DATA] (B)(E) [TSN: 969171232] [SID: 1] [SSEQ 2] [PPID 0x3c] 
01:16:28.285140 IP localhost.38412 > localhost.47509: sctp (1) [SACK] [cum ack 969171232] [a_rwnd 106496] [#gap acks 0] [#dup tsns 0] , (2) [DATA] (B)(E) [TSN: 2583310722] [SID: 1] [SSEQ 2] [PPID 0x3c] 
01:16:28.334810 IP localhost.47509 > localhost.38412: sctp (1) [SACK] [cum ack 2583310722] [a_rwnd 106496] [#gap acks 0] [#dup tsns 0] , (2) [DATA] (B)(E) [TSN: 969171233] [SID: 1] [SSEQ 3] [PPID 0x3c] 
01:16:28.533839 IP localhost.47509 > localhost.38412: sctp (1) [DATA] (B)(E) [TSN: 969171234] [SID: 1] [SSEQ 4] [PPID 0x3c] 
01:16:28.534244 IP localhost.38412 > localhost.47509: sctp (1) [SACK] [cum ack 969171234] [a_rwnd 106496] [#gap acks 0] [#dup tsns 0] , (2) [DATA] (B)(E) [TSN: 2583310723] [SID: 1] [SSEQ 3] [PPID 0x3c] 
01:16:32.713980 IP localhost.47509 > localhost.38412: sctp (1) [DATA] (B)(E) [TSN: 969171235] [SID: 1] [SSEQ 5] [PPID 0x3c] 
01:16:32.719471 IP localhost.38412 > localhost.47509: sctp (1) [SACK] [cum ack 969171235] [a_rwnd 106496] [#gap acks 0] [#dup tsns 0] , (2) [DATA] (B)(E) [TSN: 2583310724] [SID: 1] [SSEQ 4] [PPID 0x3c] 
01:16:32.774500 IP localhost.47509 > localhost.38412: sctp (1) [SACK] [cum ack 2583310724] [a_rwnd 106496] [#gap acks 0] [#dup tsns 0] , (2) [DATA] (B)(E) [TSN: 969171236] [SID: 1] [SSEQ 6] [PPID 0x3c]
```
Is it generally desirable to set `ignoreStreamIds=false`? Or `true`?

Sorry if I misunderstand.

**Comment by aligungr** [comment]
Normally according to 3GPP, AMF should handle SCTP stream identifiers. However as I observed, both Open5GS and free5gc do not handle this correctly. (Even our private AMF does not handle it correctly. :D)

Therefore we can silently ignore this problem, because stream identifiers do not have some side effects actually. (Also we tested some commercial gNBs and they also ignore stream ids.)

To conclude, ignoring the stream identifiers probably will not cause any problem. You can safely set ignoreStreamIds=true.

**Comment by s5uishida** [comment]
I was relieved to hear your explanation. I will use `ignoreStreamIds=true`.

Thank you very much.
