### ISSUE TITLE
UE has no internet connection

### ISSUE THREAD

**Issue by YunweiSun** [aligungr/UERANSIM#755]
Hello,
I installed OpenAirInterface 5G CN and UERANSIM on two VMs, PDU establishment is successful and UE has a IP address on uesimtun0, but I cannot ping google using `ping -I uesimtun0 google.com`.

**UE log :**
``` console
UERANSIM v3.2.7
[2025-02-25 16:11:08.448] [nas] [info] UE switches to state [MM-DEREGISTERED/PLMN-SEARCH]
[2025-02-25 16:11:08.454] [rrc] [debug] New signal detected for cell[1], total [1] cells in coverage
[2025-02-25 16:11:08.460] [nas] [info] Selected plmn[208/95]
[2025-02-25 16:11:08.461] [rrc] [info] Selected cell plmn[208/95] tac[40960] category[SUITABLE]
[2025-02-25 16:11:08.461] [nas] [info] UE switches to state [MM-DEREGISTERED/PS]
[2025-02-25 16:11:08.462] [nas] [info] UE switches to state [MM-DEREGISTERED/NORMAL-SERVICE]
[2025-02-25 16:11:08.463] [nas] [debug] Initial registration required due to [MM-DEREG-NORMAL-SERVICE]
[2025-02-25 16:11:08.464] [nas] [debug] UAC access attempt is allowed for identity[0], category[MO_sig]
[2025-02-25 16:11:08.465] [nas] [debug] Sending Initial Registration
[2025-02-25 16:11:08.465] [nas] [info] UE switches to state [MM-REGISTER-INITIATED]
[2025-02-25 16:11:08.465] [rrc] [debug] Sending RRC Setup Request
[2025-02-25 16:11:08.476] [rrc] [info] RRC connection established
[2025-02-25 16:11:08.477] [rrc] [info] UE switches to state [RRC-CONNECTED]
[2025-02-25 16:11:08.479] [nas] [info] UE switches to state [CM-CONNECTED]
[2025-02-25 16:11:08.539] [nas] [debug] Authentication Request received
[2025-02-25 16:11:08.539] [nas] [debug] Received SQN [000000000040]
[2025-02-25 16:11:08.540] [nas] [debug] SQN-MS [000000000000]
[2025-02-25 16:11:08.594] [nas] [debug] Security Mode Command received
[2025-02-25 16:11:08.594] [nas] [debug] Selected integrity[1] ciphering[1]
[2025-02-25 16:11:08.639] [nas] [debug] Registration accept received
[2025-02-25 16:11:08.640] [nas] [info] UE switches to state [MM-REGISTERED/NORMAL-SERVICE]
[2025-02-25 16:11:08.641] [nas] [debug] Sending Registration Complete
[2025-02-25 16:11:08.642] [nas] [info] Initial Registration is successful
[2025-02-25 16:11:08.642] [nas] [debug] Sending PDU Session Establishment Request
[2025-02-25 16:11:08.644] [nas] [debug] UAC access attempt is allowed for identity[0], category[MO_sig]
[2025-02-25 16:11:08.884] [nas] [debug] PDU Session Establishment Accept received
[2025-02-25 16:11:08.884] [nas] [info] PDU Session establishment is successful PSI[1]
[2025-02-25 16:11:09.215] [app] [info] Connection setup for PDU session[1] is successful, TUN interface[uesimtun0, 12.1.1.130] is up.
```

**gNB log :** 
```console
UERANSIM v3.2.7
[2025-02-25 16:11:02.714] [sctp] [info] Trying to establish SCTP connection... (192.168.13.131:38412)
[2025-02-25 16:11:02.744] [sctp] [info] SCTP connection established (192.168.13.131:38412)
[2025-02-25 16:11:02.748] [sctp] [debug] SCTP association setup ascId[13]
[2025-02-25 16:11:02.750] [ngap] [debug] Sending NG Setup Request
[2025-02-25 16:11:02.761] [ngap] [debug] NG Setup Response received
[2025-02-25 16:11:02.761] [ngap] [info] NG Setup procedure is successful
[2025-02-25 16:11:08.453] [rrc] [debug] UE[1] new signal detected
[2025-02-25 16:11:08.471] [rrc] [info] RRC Setup for UE[1]
[2025-02-25 16:11:08.481] [ngap] [debug] Initial NAS message received from UE[1]
[2025-02-25 16:11:08.633] [ngap] [debug] Initial Context Setup Request received
[2025-02-25 16:11:08.877] [ngap] [info] PDU session resource(s) setup for UE[1] count[1]
```

**Here is the capture :**
[capture.zip](https://github.com/user-attachments/files/18968162/capture.zip)

OAI 5G CN log : 
```console
|----------------------------------------------------------------------gNBs' Information---------------------------------------------------------------------|
   |  Index |           	Status           	|          	Global Id         	|          	gNB Name          	|            	PLMN            	|
   |	1   |          	Connected         	|            	0x01            	|    	UERANSIM-gnb-208-95-1   	|           	208,95           	|
   |------------------------------------------------------------------------------------------------------------------------------------------------------------|

   |-----------------------------------------------------------------------------------------------------------------------------------------------------------|
   |---------------------------------------------------------------------UEs' Information----------------------------------------------------------------------|
   |  Index | 	5GMM State 	|    	IMSI    	|    	GUTI    	|   RAN UE NGAP ID   |   AMF UE NGAP ID   |    	PLMN    	|   	Cell Id  	|
   |	1   |   5GMM-REGISTERED  |   208950000000106  | 2089501004100000002|    	0x02    	|    	0x02    	|   	208,95   	|   	0x0100   	|
   |-----------------------------------------------------------------------------------------------------------------------------------------------------------|
[2025-02-21 13:28:25.095] [amf_app] [debug] Send ITTI msg to SBI task to trigger NRF Heartbeat
[2025-02-21 13:28:25.096] [amf_sbi] [info] Receive Update NF Instance Request, handling ...
[2025-02-21 13:28:25.096] [amf_sbi] [debug] Send NF Update to NRF
[2025-02-21 13:28:25.096] [amf_sbi] [debug] Send NF Update to NRF, Msg body [{"op":"replace","path":"/nfStatus","value":"REGISTERED"}]
[2025-02-21 13:28:25.096] [amf_sbi] [debug] Send NF Update to NRF, NRF URI http://oai-nrf:8080/nnrf-nfm/v1/nf-instances/699a87e3-6d5a-4fff-acd1-d4a7b794069d
[2025-02-21 13:28:25.096] [amf_sbi] [info] Send HTTP message to http://oai-nrf:8080/nnrf-nfm/v1/nf-instances/699a87e3-6d5a-4fff-acd1-d4a7b794069d
[2025-02-21 13:28:25.096] [amf_sbi] [info] HTTP message Body: [{"op":"replace","path":"/nfStatus","value":"REGISTERED"}]
[2025-02-21 13:28:25.096] [amf_sbi] [debug] Send a simple HTTP request
[2025-02-21 13:28:25.099] [amf_sbi] [info] Get response with HTTP code (204)
[2025-02-21 13:28:25.099] [amf_sbi] [info] Could not get JSON content from the response
[2025-02-21 13:28:25.100] [amf_sbi] [debug] NF Update, response from NRF, JSON data:
 null
[2025-02-21 13:28:25.100] [amf_app] [debug] Received SBI_UPDATE_NF_INSTANCE_RESPONSE
[2025-02-21 13:28:25.100] [amf_app] [debug] Handle NF Update response
[2025-02-21 13:28:25.100] [amf_app] [debug] Set a timer to the next Heart-beat (10)
```

Capture on interface N3 (tun0) :
```console
root@fa6385adc61f:/openair-upf# tshark -i tun0
Running as user "root" and group "root". This could be dangerous.
Capturing on 'tun0'
 ** (tshark:6049) 13:47:24.469975 [Main MESSAGE] -- Capture started.
 ** (tshark:6049) 13:47:24.470257 [Main MESSAGE] -- File: "/tmp/wireshark_tun0PYLI32.pcapng"
    1 0.000000000   12.1.1.130 ? 172.217.18.206 ICMP 88 Echo (ping) request  id=0x0004, seq=1/256, ttl=64
    2 0.098945225 172.217.18.206 ? 12.1.1.130   ICMP 84 Echo (ping) reply    id=0x0004, seq=1/256, ttl=126 (request in 1)
    3 1.012633964   12.1.1.130 ? 172.217.18.206 ICMP 88 Echo (ping) request  id=0x0004, seq=2/512, ttl=64
    4 1.123330069 172.217.18.206 ? 12.1.1.130   ICMP 84 Echo (ping) reply    id=0x0004, seq=2/512, ttl=126 (request in 3)
    5 2.036589043   12.1.1.130 ? 172.217.18.206 ICMP 88 Echo (ping) request  id=0x0004, seq=3/768, ttl=64
    6 2.147475380 172.217.18.206 ? 12.1.1.130   ICMP 84 Echo (ping) reply    id=0x0004, seq=3/768, ttl=126 (request in 5)
    7 3.060349924   12.1.1.130 ? 172.217.18.206 ICMP 88 Echo (ping) request  id=0x0004, seq=4/1024, ttl=64
    8 3.137624321 172.217.18.206 ? 12.1.1.130   ICMP 84 Echo (ping) reply    id=0x0004, seq=4/1024, ttl=126 (request in 7)
    9 4.084955569   12.1.1.130 ? 172.217.18.206 ICMP 88 Echo (ping) request  id=0x0004, seq=5/1280, ttl=64
   10 4.113705326 172.217.18.206 ? 12.1.1.130   ICMP 84 Echo (ping) reply    id=0x0004, seq=5/1280, ttl=126 (request in 9)
```

Capture on interface N6 :
```console
root@fa6385adc61f:/openair-upf# tshark -i eth0           
Running as user "root" and group "root". This could be dangerous.
Capturing on 'eth0'
 ** (tshark:8080) 13:59:03.730267 [Main MESSAGE] -- Capture started.
 ** (tshark:8080) 13:59:03.731233 [Main MESSAGE] -- File: "/tmp/wireshark_eth05M6N32.pcapng"
    1 0.000000000 192.168.70.133 ? 192.168.70.134 PFCP 58 PFCP Heartbeat Request
    2 0.000288141 192.168.70.134 ? 192.168.70.133 PFCP 58 PFCP Heartbeat Response
    3 0.497692080 192.168.70.134 ? 192.168.70.130 TCP 74 42016 ? 8080 [SYN] Seq=0 Win=64240 Len=0 MSS=1460 SACK_PERM=1 TSval=2223166845 TSecr=0 WS=128
    4 0.497789590 192.168.70.130 ? 192.168.70.134 TCP 74 8080 ? 42016 [SYN, ACK] Seq=0 Ack=1 Win=65160 Len=0 MSS=1460 SACK_PERM=1 TSval=3055135556 TSecr=2223166845 WS=128
    5 0.497816513 192.168.70.134 ? 192.168.70.130 TCP 66 42016 ? 8080 [ACK] Seq=1 Ack=1 Win=64256 Len=0 TSval=2223166845 TSecr=3055135556
    6 0.498063705 192.168.70.134 ? 192.168.70.130 HTTP2 90 Magic
    7 0.498109975 192.168.70.130 ? 192.168.70.134 TCP 66 8080 ? 42016 [ACK] Seq=1 Ack=25 Win=65152 Len=0 TSval=3055135557 TSecr=2223166846
    8 0.498461800 192.168.70.130 ? 192.168.70.134 HTTP2 81 SETTINGS[0]
    9 0.498521126 192.168.70.134 ? 192.168.70.130 TCP 66 42016 ? 8080 [ACK] Seq=25 Ack=16 Win=64256 Len=0 TSval=2223166846 TSecr=3055135557
   10 0.498559591 192.168.70.134 ? 192.168.70.130 HTTP2 93 SETTINGS[0]
   11 0.498589419 192.168.70.134 ? 192.168.70.130 HTTP2 79 WINDOW_UPDATE[0]
   12 0.498654506 192.168.70.134 ? 192.168.70.130 HTTP2 216 HEADERS[1]: PATCH /nnrf-nfm/v1/nf-instances/71560f3a-c0d6-4a21-89dd-a4f8ba65a8db
   13 0.498699203 192.168.70.134 ? 192.168.70.130 HTTP2 75 SETTINGS[0]
   14 0.498815820 192.168.70.134 ? 192.168.70.130 HTTP2/JSON 133 DATA[1], JavaScript Object Notation (application/json)
   15 0.498943118 192.168.70.130 ? 192.168.70.134 TCP 66 8080 ? 42016 [ACK] Seq=16 Ack=291 Win=64896 Len=0 TSval=3055135558 TSecr=2223166846
   16 0.500277192 192.168.70.130 ? 192.168.70.134 HTTP2 179 SETTINGS[0], HEADERS[1]: 204 No Content
   17 0.500727931 192.168.70.134 ? 192.168.70.130 TCP 66 42016 ? 8080 [FIN, ACK] Seq=291 Ack=129 Win=64256 Len=0 TSval=2223166848 TSecr=3055135559
   18 0.500972958 192.168.70.130 ? 192.168.70.134 TCP 66 8080 ? 42016 [FIN, ACK] Seq=129 Ack=292 Win=64896 Len=0 TSval=3055135560 TSecr=2223166848
   19 0.500987146 192.168.70.134 ? 192.168.70.130 TCP 66 42016 ? 8080 [ACK] Seq=292 Ack=130 Win=64256 Len=0 TSval=2223166849 TSecr=3055135560
   20 1.071058856   12.1.1.130 ? 172.217.18.206 GTP <ICMP> 142 Echo (ping) request  id=0x0007, seq=1/256, ttl=64
   21 1.071153080 192.168.70.134 ? 172.217.18.206 ICMP 98 Echo (ping) request  id=0x0007, seq=1/256, ttl=63
   22 1.170275379 172.217.18.206 ? 192.168.70.134 ICMP 98 Echo (ping) reply    id=0x0007, seq=1/256, ttl=127 (request in 21)
   23 2.007782341 192.168.70.136 ? 192.168.70.131 TCP 93 58720 ? 3306 [PSH, ACK] Seq=1 Ack=1 Win=691 Len=27 TSval=2264707569 TSecr=1587342220 [TCP segment of a reassembled PDU]
   24 2.077452780   12.1.1.130 ? 172.217.18.206 GTP <ICMP> 142 Echo (ping) request  id=0x0007, seq=2/512, ttl=64
   25 2.077606810 192.168.70.134 ? 172.217.18.206 ICMP 98 Echo (ping) request  id=0x0007, seq=2/512, ttl=63
   26 2.193807402 172.217.18.206 ? 192.168.70.134 ICMP 98 Echo (ping) reply    id=0x0007, seq=2/512, ttl=127 (request in 25)
   27 3.100988439   12.1.1.130 ? 172.217.18.206 GTP <ICMP> 142 Echo (ping) request  id=0x0007, seq=3/768, ttl=64
   28 3.101119114 192.168.70.134 ? 172.217.18.206 ICMP 98 Echo (ping) request  id=0x0007, seq=3/768, ttl=63
   29 3.121001735 172.217.18.206 ? 192.168.70.134 ICMP 98 Echo (ping) reply    id=0x0007, seq=3/768, ttl=127 (request in 28)
   30 4.125094596   12.1.1.130 ? 172.217.18.206 GTP <ICMP> 142 Echo (ping) request  id=0x0007, seq=4/1024, ttl=64
   31 4.125478013 192.168.70.134 ? 172.217.18.206 ICMP 98 Echo (ping) request  id=0x0007, seq=4/1024, ttl=63
   32 4.152627052 172.217.18.206 ? 192.168.70.134 ICMP 98 Echo (ping) reply    id=0x0007, seq=4/1024, ttl=127 (request in 31)
```

tcpdump on UE, 192.168.13.132 is my VM of CN
```console
UERANSIM:~/Desktop/UERANSIM$ sudo tcpdump -n icmp
tcpdump: verbose output suppressed, use -v[v]... for full protocol decode
listening on ens33, link-type EN10MB (Ethernet), snapshot length 262144 bytes
13:37:41.694682 IP 192.168.13.132 > 172.217.18.206: ICMP echo request, id 3, seq 6, length 64
13:37:41.710095 IP 172.217.18.206 > 192.168.13.132: ICMP echo reply, id 3, seq 6, length 64
13:37:42.718312 IP 192.168.13.132 > 172.217.18.206: ICMP echo request, id 3, seq 7, length 64
13:37:42.736345 IP 172.217.18.206 > 192.168.13.132: ICMP echo reply, id 3, seq 7, length 64
```
Caputre on NIC0 :
![Image](https://github.com/user-attachments/assets/3b59db94-b002-41a7-90e1-307ed0bea92d)

All firewalls are turned off, and I tried enabling NAT in OAI CN with 
```console
sudo sysctl net.ipv4.conf.all.forwarding=1
sudo iptables -P FORWARD ACCEPT
```
and add a route on UERANSIM to reach OAI CN with:
```console
sudo ip route add 192.168.70.128 via 192.169.13.131 dev ens33
``` 
UE can reach UPF and AMF, but still no Internet connection.

**Comment by LSKhappychild** [comment]
@YunweiSun Can you oberve outbound traffic from UPF thru N3 interface? Check whether UPF is encapsulating ping reply packet with GTP. It seems at least ping reply reached to UPF's N3 interface side.

**Comment by YunweiSun** [comment]
@LSKhappychild 
On UPF, I can observe ping request and reply from Google.com to UE. I also think that there is something wrong with the GTP tunnel, but i dont know how to fix it. In the logs files in upf or amf I observe no errors and PDU session is also successful.

**Comment by LSKhappychild** [comment]
@YunweiSun  I am not quite sure, but it seems normal as other experiences on the web shows the ping reply only reaches up to UPF. I had the same issue, and if you need to see ping reply at the UE side, consider using other simulator. I had the same issue, and I moved to using packetrusher, and checked now the UPF sends GTP encapsulated ping reply to the UE side. 

![Image](https://github.com/user-attachments/assets/a32dcc2c-f2cb-4dbc-b756-8ebb57e8c751)
